{
  "average_confidence": 0.880225,
  "blocks": [
    {
      "block_id": "block_0",
      "confidence": 0.945952,
      "polygon": [
        {
          "x": 0.316327,
          "y": 0.197324
        },
        {
          "x": 0.716327,
          "y": 0.192308
        },
        {
          "x": 0.716327,
          "y": 0.225753
        },
        {
          "x": 0.316327,
          "y": 0.230769
        }
      ],
      "reading_order": 0,
      "text": "CUAHANG NAMOANH"
    },
    {
      "block_id": "block_1",
      "confidence": 0.857885,
      "polygon": [
        {
          "x": 0.114286,
          "y": 0.245819
        },
        {
          "x": 0.932653,
          "y": 0.23913
        },
        {
          "x": 0.932653,
          "y": 0.272575
        },
        {
          "x": 0.114286,
          "y": 0.279264
        }
      ],
      "reading_order": 1,
      "text": "Ihon Phu Thuy,Xa Phu Thi.Huyen Gia Lam,TP Ha Ni"
    },
    {
      "block_id": "block_2",
      "confidence": 0.986554,
      "polygon": [
        {
          "x": 0.318367,
          "y": 0.29097
        },
        {
          "x": 0.718367,
          "y": 0.287625
        },
        {
          "x": 0.718367,
          "y": 0.317726
        },
        {
          "x": 0.318367,
          "y": 0.32107
        }
      ],
      "reading_order": 2,
      "text": "0869322496-02438765210"
    },
    {
      "block_id": "block_3",
      "confidence": 0.359855,
      "polygon": [
        {
          "x": 0.355102,
          "y": 0.319398
        },
        {
          "x": 0.395918,
          "y": 0.319398
        },
        {
          "x": 0.395918,
          "y": 0.337793
        },
        {
          "x": 0.355102,
          "y": 0.337793
        }
      ],
      "reading_order": 3,
      "text": "T"
    },
    {
      "block_id": "block_4",
      "confidence": 0.919484,
      "polygon": [
        {
          "x": 0.340816,
          "y": 0.396321
        },
        {
          "x": 0.704082,
          "y": 0.396321
        },
        {
          "x": 0.704082,
          "y": 0.429766
        },
        {
          "x": 0.340816,
          "y": 0.429766
        }
      ],
      "reading_order": 4,
      "text": "HOADON BAN HANG"
    },
    {
      "block_id": "block_5",
      "confidence": 0.902491,
      "polygon": [
        {
          "x": 0.112245,
          "y": 0.459866
        },
        {
          "x": 0.328571,
          "y": 0.459866
        },
        {
          "x": 0.328571,
          "y": 0.493311
        },
        {
          "x": 0.112245,
          "y": 0.493311
        }
      ],
      "reading_order": 5,
      "text": "S6:SON55331"
    },
    {
      "block_id": "block_6",
      "confidence": 0.952264,
      "polygon": [
        {
          "x": 0.67551,
          "y": 0.459866
        },
        {
          "x": 0.942857,
          "y": 0.459866
        },
        {
          "x": 0.942857,
          "y": 0.493311
        },
        {
          "x": 0.67551,
          "y": 0.493311
        }
      ],
      "reading_order": 6,
      "text": "Ngay:11-08-2020"
    },
    {
      "block_id": "block_7",
      "confidence": 0.779045,
      "polygon": [
        {
          "x": 0.110204,
          "y": 0.578595
        },
        {
          "x": 0.165306,
          "y": 0.578595
        },
        {
          "x": 0.165306,
          "y": 0.615385
        },
        {
          "x": 0.110204,
          "y": 0.615385
        }
      ],
      "reading_order": 7,
      "text": "SL."
    },
    {
      "block_id": "block_8",
      "confidence": 0.814012,
      "polygon": [
        {
          "x": 0.436735,
          "y": 0.575251
        },
        {
          "x": 0.571429,
          "y": 0.575251
        },
        {
          "x": 0.571429,
          "y": 0.61204
        },
        {
          "x": 0.436735,
          "y": 0.61204
        }
      ],
      "reading_order": 8,
      "text": "Do'n gia"
    },
    {
      "block_id": "block_9",
      "confidence": 0.94412,
      "polygon": [
        {
          "x": 0.757143,
          "y": 0.575251
        },
        {
          "x": 0.944898,
          "y": 0.575251
        },
        {
          "x": 0.944898,
          "y": 0.615385
        },
        {
          "x": 0.757143,
          "y": 0.615385
        }
      ],
      "reading_order": 9,
      "text": "Thanh tien"
    },
    {
      "block_id": "block_10",
      "confidence": 0.889469,
      "polygon": [
        {
          "x": 0.112245,
          "y": 0.633779
        },
        {
          "x": 0.595918,
          "y": 0.635452
        },
        {
          "x": 0.595918,
          "y": 0.673913
        },
        {
          "x": 0.112245,
          "y": 0.672241
        }
      ],
      "reading_order": 10,
      "text": "Sira bot Ensure Gold 850g"
    },
    {
      "block_id": "block_11",
      "confidence": 0.993791,
      "polygon": [
        {
          "x": 0.430612,
          "y": 0.692308
        },
        {
          "x": 0.583673,
          "y": 0.692308
        },
        {
          "x": 0.583673,
          "y": 0.729097
        },
        {
          "x": 0.430612,
          "y": 0.729097
        }
      ],
      "reading_order": 11,
      "text": "685,000"
    },
    {
      "block_id": "block_12",
      "confidence": 0.96698,
      "polygon": [
        {
          "x": 0.797959,
          "y": 0.690635
        },
        {
          "x": 0.953061,
          "y": 0.690635
        },
        {
          "x": 0.953061,
          "y": 0.727425
        },
        {
          "x": 0.797959,
          "y": 0.727425
        }
      ],
      "reading_order": 12,
      "text": "685.000"
    },
    {
      "block_id": "block_13",
      "confidence": 0.928579,
      "polygon": [
        {
          "x": 0.114286,
          "y": 0.754181
        },
        {
          "x": 0.397959,
          "y": 0.759197
        },
        {
          "x": 0.397959,
          "y": 0.802676
        },
        {
          "x": 0.114286,
          "y": 0.799331
        }
      ],
      "reading_order": 13,
      "text": "Cong tién hang"
    },
    {
      "block_id": "block_14",
      "confidence": 0.997603,
      "polygon": [
        {
          "x": 0.8,
          "y": 0.759197
        },
        {
          "x": 0.955102,
          "y": 0.754181
        },
        {
          "x": 0.957143,
          "y": 0.795987
        },
        {
          "x": 0.802041,
          "y": 0.799331
        }
      ],
      "reading_order": 14,
      "text": "685,000"
    },
    {
      "block_id": "block_15",
      "confidence": 0.845524,
      "polygon": [
        {
          "x": 0.269388,
          "y": 0.841137
        },
        {
          "x": 0.804082,
          "y": 0.849498
        },
        {
          "x": 0.804082,
          "y": 0.88796
        },
        {
          "x": 0.269388,
          "y": 0.881271
        }
      ],
      "reading_order": 15,
      "text": "Camon quy khach.Hen gap lai!"
    }
  ],
  "duration_ms": 0,
  "engine": {
    "name": "human-oracle-draft-from-real-ocr",
    "version": "w3-draft-v0.1"
  },
  "image": {
    "height_px": 598,
    "width_px": 490
  },
  "ocr_run_id": "0e572894-eac9-5cd3-a846-21fc2c94ff4a",
  "receipt_id": "d16b4151-839b-54e3-997f-557ca3ad7a5a",
  "schema_version": "1.3"
}
