{
  "schema_version": "1.3",
  "receipt_id": "e29e8abb-1939-56b4-a4dc-847fcd568e4b",
  "ocr_run_id": "6fd87968-3478-4277-9927-7e5b0882018b",
  "engine": {
    "name": "paddleocr",
    "version": "3.0.3"
  },
  "image": {
    "width_px": 954,
    "height_px": 997
  },
  "blocks": [
    {
      "block_id": "block_0",
      "text": "CUAHANGNAMOANH",
      "confidence": 0.97345,
      "polygon": [
        {
          "x": 0.319706,
          "y": 0.194584
        },
        {
          "x": 0.726415,
          "y": 0.192578
        },
        {
          "x": 0.726415,
          "y": 0.22668
        },
        {
          "x": 0.319706,
          "y": 0.228686
        }
      ],
      "reading_order": 0
    },
    {
      "block_id": "block_1",
      "text": "086932249602438765210",
      "confidence": 0.976412,
      "polygon": [
        {
          "x": 0.320755,
          "y": 0.295888
        },
        {
          "x": 0.727463,
          "y": 0.28987
        },
        {
          "x": 0.728512,
          "y": 0.313942
        },
        {
          "x": 0.320755,
          "y": 0.31996
        }
      ],
      "reading_order": 1
    },
    {
      "block_id": "block_2",
      "text": "HOADONBANHANC",
      "confidence": 0.927417,
      "polygon": [
        {
          "x": 0.343816,
          "y": 0.402207
        },
        {
          "x": 0.710692,
          "y": 0.396189
        },
        {
          "x": 0.71174,
          "y": 0.427282
        },
        {
          "x": 0.343816,
          "y": 0.4333
        }
      ],
      "reading_order": 2
    },
    {
      "block_id": "block_3",
      "text": "S6SON55644",
      "confidence": 0.915334,
      "polygon": [
        {
          "x": 0.109015,
          "y": 0.461384
        },
        {
          "x": 0.327044,
          "y": 0.467402
        },
        {
          "x": 0.325996,
          "y": 0.498495
        },
        {
          "x": 0.107966,
          "y": 0.492477
        }
      ],
      "reading_order": 3
    },
    {
      "block_id": "block_4",
      "text": "Ngay:12-08-2020",
      "confidence": 0.874755,
      "polygon": [
        {
          "x": 0.681342,
          "y": 0.46339
        },
        {
          "x": 0.946541,
          "y": 0.45336
        },
        {
          "x": 0.947589,
          "y": 0.48345
        },
        {
          "x": 0.68239,
          "y": 0.49348
        }
      ],
      "reading_order": 4
    },
    {
      "block_id": "block_5",
      "text": "SL",
      "confidence": 0.78133,
      "polygon": [
        {
          "x": 0.106918,
          "y": 0.584754
        },
        {
          "x": 0.160377,
          "y": 0.58676
        },
        {
          "x": 0.158281,
          "y": 0.623872
        },
        {
          "x": 0.104822,
          "y": 0.620863
        }
      ],
      "reading_order": 5
    },
    {
      "block_id": "block_6",
      "text": "Thanhtien",
      "confidence": 0.978742,
      "polygon": [
        {
          "x": 0.759958,
          "y": 0.57673
        },
        {
          "x": 0.948637,
          "y": 0.571715
        },
        {
          "x": 0.949686,
          "y": 0.608826
        },
        {
          "x": 0.761006,
          "y": 0.613842
        }
      ],
      "reading_order": 6
    },
    {
      "block_id": "block_7",
      "text": "Don gia",
      "confidence": 0.86075,
      "polygon": [
        {
          "x": 0.437107,
          "y": 0.58676
        },
        {
          "x": 0.569182,
          "y": 0.584754
        },
        {
          "x": 0.570231,
          "y": 0.620863
        },
        {
          "x": 0.438155,
          "y": 0.622869
        }
      ],
      "reading_order": 7
    },
    {
      "block_id": "block_8",
      "text": "Pho bo DeNhat 65g",
      "confidence": 0.844051,
      "polygon": [
        {
          "x": 0.111111,
          "y": 0.642929
        },
        {
          "x": 0.484277,
          "y": 0.644935
        },
        {
          "x": 0.484277,
          "y": 0.679037
        },
        {
          "x": 0.111111,
          "y": 0.677031
        }
      ],
      "reading_order": 8
    },
    {
      "block_id": "block_9",
      "text": "10",
      "confidence": 0.917428,
      "polygon": [
        {
          "x": 0.113208,
          "y": 0.699097
        },
        {
          "x": 0.160377,
          "y": 0.699097
        },
        {
          "x": 0.160377,
          "y": 0.738215
        },
        {
          "x": 0.113208,
          "y": 0.738215
        }
      ],
      "reading_order": 9
    },
    {
      "block_id": "block_10",
      "text": "5,300",
      "confidence": 0.950961,
      "polygon": [
        {
          "x": 0.451782,
          "y": 0.697091
        },
        {
          "x": 0.557652,
          "y": 0.693079
        },
        {
          "x": 0.5587,
          "y": 0.729188
        },
        {
          "x": 0.45283,
          "y": 0.7332
        }
      ],
      "reading_order": 10
    },
    {
      "block_id": "block_11",
      "text": "53,000",
      "confidence": 0.934532,
      "polygon": [
        {
          "x": 0.820755,
          "y": 0.691073
        },
        {
          "x": 0.951782,
          "y": 0.687061
        },
        {
          "x": 0.95283,
          "y": 0.722166
        },
        {
          "x": 0.821803,
          "y": 0.726179
        }
      ],
      "reading_order": 11
    },
    {
      "block_id": "block_12",
      "text": "53,000",
      "confidence": 0.990295,
      "polygon": [
        {
          "x": 0.820755,
          "y": 0.757272
        },
        {
          "x": 0.951782,
          "y": 0.755266
        },
        {
          "x": 0.951782,
          "y": 0.790371
        },
        {
          "x": 0.821803,
          "y": 0.792377
        }
      ],
      "reading_order": 12
    },
    {
      "block_id": "block_13",
      "text": "Cong tien hang",
      "confidence": 0.924465,
      "polygon": [
        {
          "x": 0.115304,
          "y": 0.768305
        },
        {
          "x": 0.392034,
          "y": 0.768305
        },
        {
          "x": 0.392034,
          "y": 0.805416
        },
        {
          "x": 0.115304,
          "y": 0.805416
        }
      ],
      "reading_order": 13
    },
    {
      "block_id": "block_14",
      "text": "Cam on quykhach.Hengap lai!",
      "confidence": 0.891818,
      "polygon": [
        {
          "x": 0.268344,
          "y": 0.850552
        },
        {
          "x": 0.795597,
          "y": 0.842528
        },
        {
          "x": 0.795597,
          "y": 0.87663
        },
        {
          "x": 0.269392,
          "y": 0.885657
        }
      ],
      "reading_order": 14
    }
  ],
  "average_confidence": 0.916116,
  "duration_ms": 8296
}
