{
  "average_confidence": 0.894378,
  "blocks": [
    {
      "block_id": "block_0",
      "confidence": 0.947724,
      "polygon": [
        {
          "x": 0.085546,
          "y": 0.595611
        },
        {
          "x": 0.365782,
          "y": 0.595611
        },
        {
          "x": 0.365782,
          "y": 0.617555
        },
        {
          "x": 0.085546,
          "y": 0.617555
        }
      ],
      "reading_order": 0,
      "text": "TIENKHACH TRA"
    },
    {
      "block_id": "block_1",
      "confidence": 0.992105,
      "polygon": [
        {
          "x": 0.80826,
          "y": 0.594044
        },
        {
          "x": 0.941003,
          "y": 0.594044
        },
        {
          "x": 0.941003,
          "y": 0.615987
        },
        {
          "x": 0.80826,
          "y": 0.615987
        }
      ],
      "reading_order": 1,
      "text": "80.000"
    },
    {
      "block_id": "block_2",
      "confidence": 0.92526,
      "polygon": [
        {
          "x": 0.097345,
          "y": 0.615987
        },
        {
          "x": 0.274336,
          "y": 0.619122
        },
        {
          "x": 0.271386,
          "y": 0.645768
        },
        {
          "x": 0.097345,
          "y": 0.642633
        }
      ],
      "reading_order": 2,
      "text": "TIEN MAT"
    },
    {
      "block_id": "block_3",
      "confidence": 0.994088,
      "polygon": [
        {
          "x": 0.79351,
          "y": 0.622257
        },
        {
          "x": 0.932153,
          "y": 0.622257
        },
        {
          "x": 0.932153,
          "y": 0.639498
        },
        {
          "x": 0.79351,
          "y": 0.639498
        }
      ],
      "reading_order": 3,
      "text": "100.000"
    },
    {
      "block_id": "block_4",
      "confidence": 0.988238,
      "polygon": [
        {
          "x": 0.082596,
          "y": 0.647335
        },
        {
          "x": 0.327434,
          "y": 0.647335
        },
        {
          "x": 0.327434,
          "y": 0.669279
        },
        {
          "x": 0.082596,
          "y": 0.669279
        }
      ],
      "reading_order": 4,
      "text": "TIENTRALAI"
    },
    {
      "block_id": "block_5",
      "confidence": 0.997098,
      "polygon": [
        {
          "x": 0.80531,
          "y": 0.645768
        },
        {
          "x": 0.938053,
          "y": 0.645768
        },
        {
          "x": 0.938053,
          "y": 0.667712
        },
        {
          "x": 0.80531,
          "y": 0.667712
        }
      ],
      "reading_order": 5,
      "text": "20.000"
    },
    {
      "block_id": "block_6",
      "confidence": 0.862172,
      "polygon": [
        {
          "x": 0.238938,
          "y": 0.670846
        },
        {
          "x": 0.766962,
          "y": 0.667712
        },
        {
          "x": 0.766962,
          "y": 0.694357
        },
        {
          "x": 0.238938,
          "y": 0.697492
        }
      ],
      "reading_order": 6,
      "text": "Giada bao gom thueGTGT"
    },
    {
      "block_id": "block_7",
      "confidence": 0.887933,
      "polygon": [
        {
          "x": 0.221239,
          "y": 0.747649
        },
        {
          "x": 0.764012,
          "y": 0.750784
        },
        {
          "x": 0.764012,
          "y": 0.77116
        },
        {
          "x": 0.221239,
          "y": 0.769592
        }
      ],
      "reading_order": 7,
      "text": "Chi xuat hoa ddn trong ngay"
    },
    {
      "block_id": "block_8",
      "confidence": 0.958103,
      "polygon": [
        {
          "x": 0.079646,
          "y": 0.774295
        },
        {
          "x": 0.929204,
          "y": 0.775862
        },
        {
          "x": 0.929204,
          "y": 0.797806
        },
        {
          "x": 0.079646,
          "y": 0.796238
        }
      ],
      "reading_order": 8,
      "text": "Tax invoice will be issued within same day"
    },
    {
      "block_id": "block_9",
      "confidence": 0.871448,
      "polygon": [
        {
          "x": 0.179941,
          "y": 0.824451
        },
        {
          "x": 0.811209,
          "y": 0.826019
        },
        {
          "x": 0.80826,
          "y": 0.847962
        },
        {
          "x": 0.179941,
          "y": 0.846395
        }
      ],
      "reading_order": 9,
      "text": "CAM dN QUY KHACH VA HEN GAP LAI"
    },
    {
      "block_id": "block_10",
      "confidence": 0.943291,
      "polygon": [
        {
          "x": 0.073746,
          "y": 0.851097
        },
        {
          "x": 0.911504,
          "y": 0.854232
        },
        {
          "x": 0.911504,
          "y": 0.876176
        },
        {
          "x": 0.073746,
          "y": 0.873041
        }
      ],
      "reading_order": 10,
      "text": "Hot1ine:02471066866websitevinmart.com"
    },
    {
      "block_id": "block_11",
      "confidence": 0.365074,
      "polygon": [
        {
          "x": 0.654867,
          "y": 0.899687
        },
        {
          "x": 0.79646,
          "y": 0.902821
        },
        {
          "x": 0.79351,
          "y": 0.918495
        },
        {
          "x": 0.651917,
          "y": 0.915361
        }
      ],
      "reading_order": 11,
      "text": "MANRELE"
    }
  ],
  "duration_ms": 0,
  "engine": {
    "name": "human-oracle-draft-from-real-ocr",
    "version": "w3-draft-v0.1"
  },
  "image": {
    "height_px": 638,
    "width_px": 339
  },
  "ocr_run_id": "d3f00185-461a-5808-98dd-7ab1351cd411",
  "receipt_id": "8adbf91d-f718-5a0e-a4f6-e2c516cccab3",
  "schema_version": "1.3"
}
